[
  {
    "name": "Universum",
    "typetag": "Short film",
    "visibility": "flagman",
    "youtube": "https://www.youtube.com/watch?v=JwNwswwyqC0",
    "shots": [
      {
        "path": "./joints/universum/shot-01.webp",
        "thumbnail": "./joints/universum/thumb-01.webp"
      },
      {
        "path": "./joints/universum/shot-02.webp",
        "thumbnail": "./joints/universum/thumb-02.webp"
      },
      {
        "path": "./joints/universum/shot-03.webp",
        "thumbnail": "./joints/universum/thumb-03.webp"
      },
      {
        "path": "./joints/universum/shot-04.webp",
        "thumbnail": "./joints/universum/thumb-04.webp"
      },
      {
        "path": "./joints/universum/shot-05.webp",
        "thumbnail": "./joints/universum/thumb-05.webp"
      }
    ],
    "description": "Universum — a short film by Oganes Office."
  }
]
